tweet,Target,Source
"Telephone conversation 13427, sound recording, ARTHUR ...
 https://t.co/25zbvlkBGe › item › tel-13427
 Telephone conversation 13427, sound recording, ARTHUR KRIM and MAXINE CHESHIRE, 9/27/1968, time unknown ; Download (Right Click/Save As...): 187903-aud-tel-wh- ... https://t.co/Zku4S2C4aX",0,baseline test
"Npr Sound Treks. Animals [sound Recording].
 2010
 Book on CD | cd-spoken 791.44662 n961 a 2010
 items: 2 | circs: 41 | last circ: 7/2021
 animals,animal sounds,animal behavior,animal communication
 https://t.co/fTlrfVeuXm",0,baseline test
River Fox 2 Pieces CCTV Camera Mic Microphone for Audio/Sound Recording https://t.co/mol3iGuoFA,0,baseline test
"Hidden Camera Miota Spy Camera Wireless Security Nanny Cam with 1080P Full HD, WiFi, Night Vision, Motion Detection, Bluetooth Speaker,FM Radio,Cell Phone App,No Sound Recording Review https://t.co/ixS1xFWFUJ",0,baseline test
"Check out our Top 5 Microphones - from professional sound recording to streaming, we've got you covered 
 

 Link https://t.co/pmMti0jWo2 
 

 mic soundrecording streaming audio microphone techtips tech top5 gaming contentcreator voiceover sound",0,baseline test
"Three sisters [sound recording] : a novel / Heather Morris.
 https://t.co/KiTZp6fp1n https://t.co/8dFEL0yIOP",0,baseline test
"howtopodcast Neewer NW-13 Compact Microphone Isolation Shield+Tripod, Studio Mic Sound Absorbing Foam Reflector for Sound Recording,Podcasts https://t.co/UlnCzQWpTO https://t.co/0EsjsVAoNH",0,baseline test
"Wiktionary has a nice sound recording if you want to hear it pronounced:
 

 https://t.co/zZWFVarpUi",0,baseline test
"n-Track Studio 9.1.5 Build 5407
 

 n-Track Studio 9 transforms your PC into a simple to utilize multitrack sound recording studio. It is the ideal instrument for proficient quality sound recording, encoding, blending, and altering.
 Record, alter, overdub y… https://t.co/EhurSqkmRu",0,baseline test
"A wonderful performance by &amp; , great filming &amp; sound recording, the singing &amp; playing have such clarity &amp; never obscure the telling of a good story! BBC Four - Winter Journey: Schubert's Winterreise https://t.co/Hq1R6nVULm",0,baseline test
"Junie B., First Grader. Aloha-ha-ha! And Jingle Bells, Batman Smells (p.s. So Does May) [sound Recording]—Park, Barbara.
 2005
 Juvenile Book on CD | cdw 04990
 items: 10 | circs: 953 | last circ: 11/2021
 jones junie b fictitious character juvenile sound r... https://t.co/l9V9srBr2T",0,baseline test
"Aleph [sound Recording]—Coelho, Paulo.
 2011
 Book on CD | cd-spoken fiction
 items: 3 | circs: 100 | last circ: 11/2021
 self actualization psychology fiction,allegories
 https://t.co/Rb3obwOKWY",0,baseline test
"This Sun 3 Apr, our family-friendly afternoon event Mwalimu Express is back with live music from 
 Kadialy Kouyate's Sound Archive , master of the Kora. Join us for games, dancing, street food and live music!
 

 Book tickets &gt;https://t.co/WUum7niz9Z https://t.co/EH2GPR2cwg",0,baseline test
"January 13, 1982 - The Big Freeze Of '82 - The On-Going Situation In Poland - A Sit-Down With Hosni Mubarak. – Past Daily: News, History, Music And An Enormous Sound Archive. https://t.co/mggQpkECAO",0,baseline test
"Imperial Wax Solvent, one of *the* great late-period Fall albums, was released on this day fourteen years ago-ah.
 

 Some thoughts here: https://t.co/0DwA9CjSSI
 

 TheFall https://t.co/0AbvvmUTqx",0,baseline test
DIVFUSE Sound Archive Open Call No. 2 - 1 of 5 selected work : Descriptive Realities by Seo Hye Lee was made in collaboration with Call and Response Gallery and the deaf blind charity Sense. Audio description is added onto sounds of domesticity. More on https://t.co/h5BU4uhhct https://t.co/XFvnk9pP1Q,0,baseline test
I Just bought tickets to BLACK ANZAC https://t.co/9tCrbrWE7v National Film and Sound Archive via,0,baseline test
NPLGNN joined by Majazz Project (Mo'min Swaitat) the next hour for one hour of Palestinian sound archive restored directly from old cassettes // https://t.co/XEyBvLPZrz https://t.co/TOToXIX4nK,0,baseline test
"Jeanne Gautier And Yvonne Lefébure Play Music Of Ravel - 1953 - Past Daily Weekend Gramophone - Past Daily: News, History, Music And An Enormous Sound Archive. https://t.co/1N4VsW0xiw",0,baseline test
"“You're terrible, France!”
 

 French promotional poster for Muriel, Une Comedie de P.J. Hogan (1994), from the Australian National Film and Sound Archive collection
 

 https://t.co/B7aHnhZn3y https://t.co/g0PUS4PlUX https://t.co/XYMyDwZOOj",0,baseline test
"*New Blog* Fascinating historic sound project from the Leonard Cheshire Archive https://t.co/bj9ZdqseST 
 

 oralhistory archive heritage",0,baseline test
"Friday night, deep in the sound archive with John Peel mixtape par excellence, 007, https://t.co/k9TeSnOPgO https://t.co/zqd1pk6Sla",0,baseline test
"The Pascal Quartet Play Music Of Guy Ropartz - 1950 - Past Daily Weekend Gramophone - Past Daily: News, History, Music And An Enormous Sound Archive. https://t.co/CexSt5YvM3",0,baseline test
"Dexter Gordon - Live In Berlin - 1967 - Past Daily Downbeat - Past Daily: News, History, Music And An Enormous Sound Archive. https://t.co/JfLkkagueM",0,baseline test
"Dr new stories and exhibits shared with the KHOYA Sound Archive online platform, celebrating Maghrebi traditions on family and birth.
 

 The event will also include a live chamber performance of new compositions celebrating fertility: https://t.co/BBkwQD53pw https://t.co/REssM4ETG8",0,baseline test
"""""I Am Woman"" was written by Reddy, noticing an absence of songs tackling the topic of what it means to be a woman. The track went on to shape an entire generation of women whose activism in support of equal rights reverberates to this day. https://t.co/Azqie8ltgI",0,baseline test
Aussie friends grab a ticket and see Space Faring Civilisation Film Festival at National Film and Sound Archive https://t.co/WT6vQuaVOc National Film and Sound Archive via,0,baseline test
Sheet Music Art LAMP https://t.co/bxwMFAgOtp via homedecor retro musicnightlight musiclover https://t.co/4M9fznHiv3,0,baseline test
OFFER: Old sheet music (Bedford MK43) https://t.co/GFmXM0AlYY https://t.co/ymsbN1jAH1,0,baseline test
"All American Country. Vol. 1 : Some Of Your All-time Favorite Country Standards : Complete Original Sheet Music Editions.
 1994
 Music Score | m3.0642 fa416
 items: 3 | circs: 57 | last circ: 7/2017
 country music
 https://t.co/PuoFOy1QaL",0,baseline test
MIT develops a speaker thinner than sheet music https://t.co/f9GtSWhJAZ,0,baseline test
"As long as I'm doing some self promoting, I switched to an easier payment system on my site. Wanna buy some sheet music? https://t.co/1F4r0n7FEj",0,baseline test
"Reading singing sheet music is an entirely different skill from singing. A professional like Robert Emery can walk you through the steps of reading musical notation and ensure that you’re building your skills on a solid foundation of music theory. 
 

 https://t.co/QjFDrC9x5N https://t.co/VzV0dRGwQp",0,baseline test
Did you know that you are part of God's symphony? God is the master conductor. The Bible is the sheet music. And each of us are musicians doing whatever God gave us the talent to do. See the latest episode: https://t.co/7hMYbMiCq5 spiritualgifts https://t.co/ofCW3KoxkH,0,baseline test
Trying to find sheet music... https://t.co/V1x0JmcIV9,0,baseline test
"Can YOU stay awake to play Brahms Lullaby? Try out my extra gentle arrangement for harp, written in 4/4 instead of the traditional 3/4. Listen to the video in the comments, and get the sheet music at https://t.co/TGHi3vVu9L https://t.co/r9d5bSKF0u",0,baseline test
"RockJam 88 Key Digital Piano Keyboard Piano with Full Size Semi-Weighted Keys, Power Supply, Sheet Music Stand, Piano Note Stickers &amp; Simply Piano Lessons
 

 More Details Here: https://t.co/tkYR0zgMIk https://t.co/HwJmX3sikT",0,baseline test
OFFER: Hardback sheet music for pianists (Queen Edith's Ward CB1) https://t.co/RComYMWpv7 https://t.co/PDt7rKjS87,0,baseline test
"DIY sheet music pendant necklace tutorial from . Easy fun way to upcycle sheet music and create unique jewelry for yourself, to give as gifts, and to sell on Etsy and at craft fairs! https://t.co/QaBUutitKE DIY sheetmusiccraft pendantnecklace https://t.co/UD6snTw235",0,baseline test
"DocoftheDay: Sheet music for “Our West Virginia” by Jess Baker Schaub
 

 https://t.co/1vTwdjaagv https://t.co/RoK7ihrQvJ",0,baseline test
"https://t.co/3BjmzTD4Ai
 

 i mean.. i found the song",0,baseline test
"New artwork for sale! - ""Sheet Music, 1917"" - https://t.co/IiFAaJNQVN https://t.co/wbXKkkaOzA",0,baseline test
ListenOK is a guide to oral history collections from different institutions across Oklahoma. This resource is freely accessible to the public and gives people access to a broad range of oral histories. https://t.co/TnOdR5K1dG,0,baseline test
Listen to the voices of our past with Oral History Project. Recount the stories of those who helped build our city: https://t.co/tIHkLqW17K. https://t.co/bwzLppRYKm,0,baseline test
"Ōtautahi folks! The Alexander Turnbull Library will be offering its two day, 'Essentials of Oral History' course in Chch on 13 May and 18 June 2022. More info and contact details on the website here: https://t.co/qRY1RZOwt8 oralhistory glam aotearoa",0,baseline test
The 1956 Institute Foundation has retained a digital version of its extensive archive of oral histories. My uncle’s oral history is collected there as well. https://t.co/lP5DDGb58i https://t.co/SEmOi5h4Il,0,baseline test
"Looking for a way to observe Yom Hashoah? The United States Holocaust Memorial Museum has an excellent collection of testimonies from Holocaust survivors. Link below.
 

 https://t.co/kN78kmwQko https://t.co/02NWLLh3n1",0,baseline test
"Artist Eothen Stearn uses LHSA's archive and her own oral history recordings to reflect on Edinburgh's past HIV epidemic and to question current discrimination. Join us , 3 May, to discuss Eothen's practice and the history that inspired it: https://t.co/7UzNhvjK3t https://t.co/jd4Kay0Hz4",0,baseline test
"Annual reminder about valuable oral history resource at Australians at War Film Archive, 2000 interviews with ex servicemen and women giving personal, often moving accounts of wartime experience - including thoughts (spoiler: mixed at best) on AnzacDay https://t.co/LDJei48PYC https://t.co/fZxcfg3d4F",0,baseline test
Detroit Oral History 100 stories. Williams Pavillion presentation https://t.co/wJmG1L2Gja https://t.co/FBRRM90BNK,0,baseline test
"STEAM ICON Charles Parker (1919-80) was a groundbreaking BBC radio producer who made programmes that foregrounded the voices of working people for the first time. His 'Radio Ballads' are a landmark study in oral history https://t.co/f6iMjdWoUu
 Credit: Charles Parker Archive Trust https://t.co/0AJLnRmomN",0,baseline test
"Now available! ""Hard Rain is a rich and genre-busting meditation on oral history, on culture, on folklore, on poetry, on music, on Bob Dylan, and on many other things besides."" - Mitchell Duneier https://t.co/IpUO3q9tFW BobDylan oralhistory music folkmusic https://t.co/uIGo0FDh2o",0,baseline test
"https://t.co/swB3oRZjhj My Name Is Bracha. This is an 8 minute segment of my father’s contribution to an oral history project about Jewish chaplains in WW2. It’s about a woman who can no longer tolerate hiding her Jewish identity, even though her life depends upon her doing so.",0,baseline test
"Today is National TELL A STORY day. The SD State Historical Society is the guardian of our SD stories, but we need your help.
 

 DONATE NOW to our Oral History Project! Read more about this special project, and help us save SD stories by donating at
 https://t.co/3JoloITHlx https://t.co/Cc6wGLn6iK",0,baseline test
I loved the Oral History of Better Call Saul episode that Ringer Prestige TV podcast did a few weeks ago. https://t.co/XZiqM9RBhT,0,baseline test
On the Library's event page now! https://t.co/U52UqTRrMg,0,baseline test
"You’ll be able to explore interactive maps, before &amp; after photos, &amp; oral history interviews with local residents to find out what happened. At the end of the experience you can, vote for what you think the most significant turning point was. 
 

 Learn more: https://t.co/mTNpXMnfu7",0,baseline test
"""On a Sunday, old Uncle Cox used to read the News of the World to everyone in his pub for the benefit of those that couldn't read"" Fantastic interview from 1927 in the George Ewart Evans archive. https://t.co/bsdXd3eEKr",0,baseline test
"Dig in to the history of this abandoned coal town and its rise from the ashes 
  (12 ratings) madrid newmexico tour 
 https://t.co/BiQU8x2L0E",0,baseline test
When Max Met Furiosa: An Oral History of Casting Mad Max: Fury Road | New York Magazine https://t.co/ik4poAhSN7,0,baseline test
"Our own Amy Weinstein, Vice President for Oral History &amp; Museum Collections at the 911Museum is a keynote speaker at the virtual 2022 Oral History in the Mid-Atlantic Region Conference (). Tune in April 29 &amp; 30.
 

 Learn more: https://t.co/DZrZSEEEGI. https://t.co/XnXe58EVhz",0,baseline test
ASERL Is Expanding Its Oral History Collection https://t.co/yNaLdBjpBS via ITI Newsbreaks,0,baseline test
Brand new oral history project with volunteering opps focused around women and the pandemic. Thought your followers might be interested. Could you give it a share? Full details on our website https://t.co/x2GU8hkJt8 https://t.co/kSbl9B0kmv,0,baseline test
"“If you’re not creating animosity or hate, then you’re not doing very much against the system or the people that propagate… the repression.” Elbert ""Big Man"" Howard, BlackPanther, oral history interview | 2016 June 30 | Library of Congress https://t.co/rgu6dOQWza",0,baseline test
"I'm thrilled to announce my new book, THE COME UP: An Oral History of the Rise of Hip-Hop. It comes out on 10.18.22, and it's available for preorder now: https://t.co/Fzu84iH7oY",0,baseline test
"The first of three Guest Posts on the by Helen King focusing on the oral history archive, entitled ""Brave Wanderers"":
 https://t.co/7jvxTVuosU
 

 Gujaratis oralhistory refugeehistory",0,baseline test
"Allie Roberts is from Guntersville, Alabama, and she began working in 2021! After graduation, Allie hopes to teach US History. You can read an oral history from her favorite collection here: https://t.co/nsWwHdoQJU! https://t.co/d5EN3BCOrU",0,baseline test
"Ta M. Li’s knack for marketing &amp; passion for mining led to a multi-faceted mining career. Hear him tell his story. https://t.co/ITgcCiHafI
 AIMEOHCP oralhistory historymatters https://t.co/QoFNWqu3ly",0,baseline test
"Oral history, theatre and exhibition come together in 'Tsunagu/Connect', bridging Britain and Japan. Shoreditch Town Hall, London, until 30th April. Read our review: https://t.co/hjuwAPKoTD.
 Image Ikin Yum.
 

 tsunagu londontheatre artlondon artmag https://t.co/acatn1p7rw",0,baseline test
Here's how we did oral history in the 1980s and how we do it now https://t.co/8WpjfGTvh9,0,baseline test
"Recording of the week: guitarist Ernest Ranglin, from the Oral History of Jazz in Britain https://t.co/lqkbmiBTBF Photo by Val Wilmer, used with permission. https://t.co/gkqa5RNnDh",0,baseline test
"Happy Garth day, everyone! I'll be kicking off today's content with my favourite video interview of his. It's a wonderful window into his brain. He shares biographical information, his influences, as well as his insight into music theory and improvisation. https://t.co/RUS3rMXhNY",0,baseline test
"I'm old enough to remember stories from my (slightly older) friends about how they percussively ""cancelled"" the nazis from punk. It was good.
 

 https://t.co/1KmtwFO5yg",0,baseline test
"Check out our podcast, Catcher Media Presents, where we delve into subjects from how to make your own oral history interviews in our Heritage strand to Health issues that affect young people. 
 

 All episodes are available here or on streaming services: https://t.co/AJTaGgyv66",0,baseline test
"Do you know what is the significance of Judge Judith S. Kaye’s red shoes? 
 

 WomensHistoryMonth 20thAnniversaryHSNYC 20YearsNYLegalHistory
 

 Find out in Judge Kaye's own words, from her oral history recording, in this blog post:
 https://t.co/J3DV9x9zY4",0,baseline test
"The Putin Files — interviews conducted for the 2017 documentary ""Putin's Revenge"" — offer an extensive oral history of the Russian president's rise to power, his motivations and his relationship with the U.S. Explore: https://t.co/67zC2NLdva",0,baseline test
"Don’t miss FREE Webinar on 'An Afro-Caribbean in the Nazi Era: Oral History and the Black Family' on Sat 19 February at 19:00 GMT. Learn about Lionel Romney, a Black man who was imprisoned in a Nazi Concentration Camp and survived. Book your FREE ticket at https://t.co/nV6O7sIW7d https://t.co/ZfFFphWDmF",0,baseline test
Music research paper | Reading homework help https://t.co/Dr8oYMmCAj,0,baseline test
"If you want smarter kids, don't teach them coding. Teach them music! Research carried out by MIT and published in the Journal of Neuroscience is now showing how powerful music can be on a child's brain development. Read more here https://t.co/MUF9Ncq8ga https://t.co/ShnsRyOMDN",0,baseline test
"Course :World Indigenous Music RESEARCH Paper Focus of the paper should be on a topic related to a world music tradition, which could include a focus on region, a performer, a genre, instruments, et https://t.co/ite6cpOzGo",0,baseline test
"SUCreativeOutputs 
 

 herri is an online arts journal, conceived and edited by Aryan Kaganof, a Research Fellow from the Stellenbosch University Africa Open Institute for Music, Research, and Innovation.
 

 https://t.co/YdmZnoDuPT https://t.co/mD74XMkigG",0,baseline test
music research paper https://t.co/Zq6ixAE60g,0,baseline test
I'm currently studying a Master of Music (Research) investigating collaborative singing in virtual reality and videoconferencing. Also part of a research team exploring the ethics of biometric capture in immersive music performance https://t.co/HM6a8m8cIE,0,baseline test
Check out my background in music research. https://t.co/BuEtrmmkYn https://t.co/8LB0Cjr6It,0,baseline test
Music research https://t.co/lPAsYsHQMr,0,baseline test
"Know any displaced music researchers, students, teachers? is offering free membership, mentoring, and access to bursary schemes to support music research ""in the broadest sense"" to researchers displaced due to conflict. https://t.co/yee4aMocdl",0,baseline test
"The new issue of Popular Music Journal is out now! Including an article from our colleague Bernhard Steinbrecher about Mainstream popular music research. The article is open access:
 https://t.co/kV1RE0kbg7",0,baseline test
"Aiding Soundtrack Composer Creativity through Automated Film Script-profiled Algorithmic Composition' Music 
 Research  
 https://t.co/KrwM1hYpbw",0,baseline test
"I am honored to be appointed to the advisory board of the American Music Research Center.
 Thank you Susan Thomas, director 
 

 https://t.co/1pzOqX7bz6",0,baseline test
"There's a lot to do, and we're excited to meet the challenges. Your support will help us continue building collections, preserving and making music accessible, creating meaningful work opportunities, and supporting new music research and scholarship.
 

 https://t.co/KgSnOep01O",0,baseline test
"Is music truly a universal language? At Princeton, they did a study to put this to the test... 
 https://t.co/r9QZQDYPxK music research",0,baseline test
"Enjoy access to The New York Times, now available at Boise Public Library! Discover original, quality journalism that helps you make sense of this moment — and make everyday life better. Start exploring today at https://t.co/5H9nygF3o2 https://t.co/iXMQTvPTU8",0,baseline test
We launch this semester's Music Research Seminar series on 3 February with in the fabulous West Court . Book an in-person seat here: https://t.co/J32OSQD4SQ,0,baseline test
Deirdre's Dream: a personal exploration of the pibroch echo beat's basis in Gaelic song': Prof Joshua Dickson () presents our first research seminar of this semester on Weds 2 Feb at 4pm - for more details (and zoom link) see: https://t.co/81FgMyKtxI https://t.co/YcpOEHnDfQ,0,baseline test
Music Research Seminar Series - Dr Kathleen Turner https://t.co/cknFwhhdZd via,0,baseline test
"Join us tomorrow! Dr. Ayana Smith will focus on her ongoing projects regarding ethical practices and social justice in early music research, pedagogy, and performance
 https://t.co/XxRQsXXJ2m https://t.co/j68KMZIjjG",0,baseline test
"*TODAY* 4pm UK: Join us for the first music research seminar of 2022  Prof. Salwa El-Shawan Castelo-Branco on ""The Interceltic Festival of Porto: Europeanisation, Cultural Politics and Global Musics"" Zoom https://t.co/aExI88mgZz https://t.co/TRw28Skv03",0,baseline test
"Measure of Music Project/Hackathon registration NOW OPEN!
 

 Plus, Friday keynote session announced on Music Research in 2021, and so much more.
 

 HUGE thanks to our presenting sponsors: , ,  
 

 Sign up at https://t.co/bxs3lcMSRJ. https://t.co/UJhIDmAT7J",0,baseline test
"IASPM January 2022 Research Seminar 
 

 Amsterdance – The Amsterdam Electronic Dance Music Research Group
 

 Thursday 20/01/22 - 16:00 CET / 15:00 GMT
 

 Free Event - Tickets through Eventbrite
 

 This month's event is being curated by .
 

 https://t.co/90DQJZaKHD",0,baseline test
"Turning on the tunes: 3 evidence-based benefits of music. Research shows that music is a seemingly safe complementary and alternative strategy that may hold health benefits.  
 mentalhealth aging music Mississauga Hamilton Brantford Cambridge 
 https://t.co/VhwBcKf20F",0,baseline test
"‘Global Winds’: Circulations, Circularity, and Coastal Historiography' - this week's Music Research Seminar is presented online by (), discussing the music of 1920s/30s Shanghai. For more details (and zoom link) see: https://t.co/fzSiiQaQHt https://t.co/PPCFb9bwXa",0,baseline test
Reminder: 1. – 3. March 2022 Jewish Music Research - International conference jewish music history at the University of Music Hamburg See for Information and registration https://t.co/vuMw7eo7Hk https://t.co/bON3sg9Qgx,0,baseline test
"Did you know that all ISM members have access to Grove Music Online, the leading online resource for music research? Plus the Oxford Dictionary of Music and The Oxford Companion to Music.
 Find out more https://t.co/pDot8Hqmbx https://t.co/TQPr5mLCAU",0,baseline test
Tremendous resources for Yiddish music research at the New York Public Library. Register for this free course here: https://t.co/GTpJMoaAQC https://t.co/5npcWL4U3H,0,baseline test
"Music Research Seminar: discusses the development of his upcoming 'Horse Ape Bird', a new youth opera to be performed in Maynooth in June. This in-person event will be on Weds 30 March, 4pm, in the Bewerunge Room, Logic House. https://t.co/Hy2rLkiSaf https://t.co/OiEEuWa2CS",0,baseline test
americanamusic folkmusic songwriter nashvillemusic Americana Rhythm Music Magazine in Nashville did a blog about my THIS CURIOUS WONDER album recently. I really appreciated it. In case you have an interest here we go :) https://t.co/knHNspSbce,0,baseline test
"SLAM alternative music magazine 121 (Mai/Juni 2022)
 placebo placeboworld neverletmego placeboneverletmego https://t.co/g7plsMDaU4 https://t.co/il05g7Py5D",0,baseline test
"Our publication 'Railways &amp; Music' has been featured in BBC Music Magazine! Read now for free: https://t.co/6RSamh7rj0
 

 BBCMusic openaccess music musichistory research OA highered https://t.co/JK9cBn5WMc",0,baseline test
"First Listen is a brand new, made-in-Saint John music magazine. Amelia Bailey created this as a way of bringing the local music scene together. She spoke with  about her first three issues and why Saint John needs indie publishing.
 https://t.co/6iUV6CAQd4",0,baseline test
Under RIPM's domain: The musical messenger - the first black music magazine (fun fact: together RIPM and RILM provide access to two hundred and fifty years of music periodical literature and are designed to complement each other chronologically). https://t.co/Pfeh8lV25b,0,baseline test
Hey folks! We are on The Wire! We talk sonification with the world's greatest music magazine...and it rocks! https://t.co/q0GjeD3YSo https://t.co/i7PhA26XgS,0,baseline test
Jamsphere Indie Music Magazine January 2022 - https://t.co/oFAZGTdHWY https://t.co/Cvt1dB8f6G,0,baseline test
HOT HALF DOZEN 3.29.22 – IndiePulse Music Magazine https://t.co/O5h1aTXVFU,0,baseline test
I had the pleasure of interviewing Nez Perce jazz singer for (Chamber Music Magazine) and it looks like it's been published. Check it out here: https://t.co/8N4e0R7MmV,0,baseline test
IndiePulse Music Magazine Volume 2 Issue 8 February 2022 https://t.co/j4Myo7KxLu via,0,baseline test
The Women Behind the First Black Music Magazine https://t.co/Q46TocmYf3,0,baseline test
Freddie De Tommaso's debut album has been nominated under Newcomer in the BBC Music Magazine Awards 2022. Congrats Freddie! https://t.co/qF6YTvJkbj via,0,baseline test
The Women Behind the First Black Music Magazine https://t.co/xOqotSH5UQ https://t.co/m3LL8uaHye,0,baseline test
"Only $0.99! 
 

 https://t.co/Dqlr0EVmV9 https://t.co/fmBRx2BP2K",0,baseline test
Reflections of Darkness - Music Magazine - Live Review: OMD - London 2022 https://t.co/087kpBUbl3,0,baseline test
NoiseHype are an online music magazine promoting the best new music from up and coming artists! https://t.co/KjldVeXCtX,0,baseline test
Celebrated Soul/Pop Artist Laura Cheadle Reveals Details For Her Sultry New Single “The Lust In Between” – IndiePulse Music Magazine https://t.co/vnhzFHYCjC,0,baseline test
