tweet,Target,Source
"Explore new digital library
 and discover a list of resources for built environment practitioners fostering more equal, healthy and sustainable places.
 

  More at: https://t.co/QTlwYNImEy https://t.co/Uipk8Hss2u",0,baseline test
"NEWS | The Library has been awarded a second grant by 
  to continue work on the Sinai Manuscripts Digital Library, supporting the identification &amp; description of 152 Syriac parchment manuscripts from Egypt's St. Catherine’s Monastery: https://t.co/NJHIUKq6WU
 

 openaccess https://t.co/QTs38EdQLE",0,baseline test
How have Angelenos dealt with changing environmental conditions through the years? Some snapshots this EarthDay via UCLALSC's Photographic Collection https://t.co/AoAe8AB2SM https://t.co/EbSgRD5AJi,0,baseline test
"[Coaches' Film: North Texas State University vs. , 1975] https://t.co/IGqlG6iBuo",0,baseline test
"Arabic Collections Online (ACO) is a publicly available digital library of public domain Arabic language content, currently providing access to 17,262 volumes across 10,148 subjects (from collections of distinguished research libraries). https://t.co/0RtWl1bpTS siteoftheweek",0,baseline test
Find the full proceedings from the Nordes 2021 conference on the DRS Digital Library: https://t.co/XjJBox5fpi https://t.co/Shv78w0nRt,0,baseline test
Resources! Resources! ExecutiveCoaching CoachingLibrary https://t.co/odKmF8goMp,0,baseline test
The Church and Ecology (1970) science lecture by Wallace E. Fisher https://t.co/bt6876qFB5 audio transcript DigitalFridays EarthDay2022 Image: Snippet of Item Details page from the Theological Commons digital library with photo of bright green grass as background https://t.co/27GaiL6IOU,0,baseline test
"Did you know that your library card gives you access to eBooks and eAudiobooks? Join us to learn how you can use Libby and Hoopla while on the go or from the comfort of your home. Reserve your spot: https://t.co/xFRBzTRdcA
 DigitalLibrary YorkRegion Markham LibraryCard https://t.co/sQ6fpzl833",0,baseline test
Big News! CDs are $15 and digital MP3 show downloads are only $5 thru May 8th Get our live concert recordings for your physical or digital library at https://t.co/hfeQPprcYa! https://t.co/5H0WYSMHtB,0,baseline test
"NYC's libraries, , are taking a stand against recent bookbans by giving readers across the U.S. access to their e-books for a limited time. Get your FREE digital library card here: https://t.co/L9v7FFyGGW https://t.co/9TM0rtBqDY",0,baseline test
Online today: two issues from J. S. Ogilvie's Play Book Series. https://t.co/GqFu0nPikQ https://t.co/dLEpdgSHOw,0,baseline test
"New Content: Minnesota Weavers' Guild newsletters. 
 

 MDL recently added 75 quarterly member Newsletters produced by the to its OnlineCollection. Read more and access the collection using this link: https://t.co/ycthog3hdO https://t.co/A861qWYSTg",0,baseline test
"Brooklyn Public Library is Offering Free Digital Library Cards To Young Adults in the US
 

 BOOKS
 

 https://t.co/hgiNkG2F0z",0,baseline test
Christmas Post Office [Unpublished] – Waterloo Digital Library https://t.co/PjCBOvdpBB,0,baseline test
ACM articles published during the first 50 years of publication (1951-2000) are now open and freely available to view and download via the ACM Digital Library - https://t.co/6bKeqGG5Nc,0,baseline test
Enjoy free access to the Wall Street Journal online with your ICPL resident card and password/pin: https://t.co/WFqcTLLccS https://t.co/HcYaZ4Lqe5,0,baseline test
"All Santa Barbara Public Library locations will be closed tomorrow 3/31 for Cesar Chavez Day.
 

 While we are closed, you are still able to access our digital library from anywhere, 24/7. https://t.co/aPoFYKB3aa",0,baseline test
Wind chill keeping you home today? Cuddle up with an ebook from our Digital Library! Visit https://t.co/Elt6MgvaHk or download the Libby app to browse and borrow. https://t.co/vsO2fcJ2GX,0,baseline test
"From Cornell archives
 

 https://t.co/Vq63xMjBbW",0,baseline test
"Breathe in. Breathe out. Focus your mind on the present moment. Join us for Mindfulness Meditation, live-streaming from https://t.co/I8eclT0bCp today at 10am ET. We also have recorded sessions available on our Digital Library! meditate tranquility integrativeoncology https://t.co/ErLKgm2kTu",0,baseline test
"National Digital Library. Vast collection of resources available at
 https://t.co/KUMcMW23ag
 Students please check this link.",0,baseline test
"Online today: three issues of Street &amp; Smith's New York Weekly from February, 1897. https://t.co/RzZ8wdcbUe https://t.co/gwEJK8XcYZ",0,baseline test
"Marine Construction Magazine, Issue II 2022 is out now! Subscribe to read the full digital edition but you can read a sample at https://t.co/63gNMYVD59
 

 OfficialMarineConstructionMagazine MCMag MarineConstruction MarineConstructionNews DockConstruction newissue https://t.co/fChVkfo4vJ",0,baseline test
"The latest edition of MotorPro has landed! We have another digital edition available to everyone, so you can get a taste of one of the many benefits of being an IMI Member Read this month's MotorPro Magazine now https://t.co/41yEBK5l5q Automotive Technology https://t.co/gwqe3PHkLi",0,baseline test
"OUT NOW: the new digital edition of ARTMAG has the latest Scottish arts news. View and download it: https://t.co/qP8kihmhoE
 Image Gill Walton, .
 onlinemagazine digitalmagazine magazines magazine artmagazine artmagazines artmaguk artmags https://t.co/K9PUaXkxx4",0,baseline test
"Out Now!
 

 Get your FREE digital edition of Together magazine!
 

 Click here: https://t.co/iQMPaLAkCK
 

 TogetherMagazine DigitalMagazine FreeMagazine ChristianResources Publishing Books Music DVDs https://t.co/g6ik34e5LJ",0,baseline test
Tri State Thrifty Nickel 4-28-22 Digital Edition https://t.co/UyhRcPkpdp via,0,baseline test
"Check out the ACCLEAN Pit &amp; Fissure Sealant System in the latest issue of ! 
 

 Read now: https://t.co/5PYrcpYupp https://t.co/IWFOFB0Cwk",0,baseline test
"WNY Family's MAY ISSUE began print distribution on Thursday, April 28 and the complete digital edition is now available on our website at https://t.co/lajAsCLMkY https://t.co/0uCv57DQvw",0,baseline test
"RHCOM Sturdy Material Carrying Case Compatible with Playstation 5 and PS5 Digital Edition，Playstation Controller, PS5 Games, Gaming Headset, and Gaming Accessories（Only case） https://t.co/hTNbfW3dnh",0,baseline test
"The digital edition of is also now available to read on your desktop PC/Mac, tablet or smartphone anywhere in the world!, right now! Download your copy at https://t.co/ZMXAVZAMWt https://t.co/GJYlTtP1Lh",0,baseline test
"The 2022 edition of the Kiosk is here! 
 

 Kiosk, Morningside's Art and Literary Magazine, is an award-winning, student-run publication. This year's magazine is dedicated to President Reynders and his amazing wife, Robin. 
 

 Check out the digital edition!
 https://t.co/5sf7nUYn6v",0,baseline test
The digital edition of our latest issue of Hot Topics in Atopic Dermatitis - a supplement - is now available online! https://t.co/1B0W27p9eS https://t.co/lIIklCfOV8,0,baseline test
"Look for some new reading material?
 

 Sign up to our e-newsletters and you'll receive a FREE digital edition of Camping magazine to read on the go!
 

 Simply click here to sign up: https://t.co/6Jd46QjlbE https://t.co/oIG6k5tdTW",0,baseline test
"Matt Younkin's freight dog tribute Beech 18 is featured on the cover of the May 2022 issue of EAA Sport Aviation alongside his famous showplane, Magic by Moonlight. The digital edition is available for EAA members now: https://t.co/A3VIwWWlp4 Scott Slocum https://t.co/aTK6q4P6fU",0,baseline test
DECEMBER DIGITAL EDITION - Staying calm amid the noise https://t.co/RuyPELtZPa https://t.co/c4a1oVZQbn,0,baseline test
"Starlink: Battle for Atlas Digital Edition – £12.59 (82% off, matches previous low) https://t.co/CN8Gf3zcaD",0,baseline test
"Read Aberdeen Airport’s official magazine!
 Free digital edition available now - https://t.co/ve574xEJBZ https://t.co/S809eotzOI",0,baseline test
"Sony Playstation 5 Digital Edition PS5 Gaming Console, x86-64-AMD Ryzen Zen 8 Cores CPU, AMD Radeon RDNA GPU, 16GB GDDR6 Memory, 825GB SSD, WiFi 6, Bluetooth 5.1, Ethernet https://t.co/hO4lcDHg9M",0,baseline test
Live outside the UK and don't fancy waiting for a print copy of SFX to arrive? Why not subscribe to our digital edition and get it delivered to your device? Sign up with our Spring Sale and get your first five issues for $5 (or €5)! subscribetoSFX https://t.co/WinqkJuxO0 https://t.co/GxTUl9IpKK,0,baseline test
"PlayVital Nylon Dust Cover for ps5, Soft Neat Lining Dust Guard for ps5 Console, Anti Scratch Waterproof Cover Sleeve for ps5 Digital Edition &amp; Disc Edition – Urban Digital Camo Review https://t.co/iBdZaOytMV",0,baseline test
"May 2022 issue of PHPI available to read online NOW! 
 

 The digital edition of the new issue of PHPI is available to read online now.
 

 Find out more at https://t.co/LNyb3UbPmc https://t.co/Q7y1F2iE8Q",0,baseline test
Read the Spring 2022 digital edition of SportsTravel! This issue celebrates the 25th anniversary of the first issue of SportsTravel in 1997. Stories in this issue include looks back at where the industry has come since then and where it is headed next. https://t.co/2EP1mw2U2Z,0,baseline test
"This digital edition will remain available for the time being.
 https://t.co/0daNcz4dcU",0,baseline test
Cooler Fans For PS5 Cooling Fan Playstation 5/PS5 Vertical Cooling Stand For PS5 Controller Charger Disc/Digital Edition Console https://t.co/ksDe1icZUN,0,baseline test
"Check out this months OptiMYz digital edition for free!
 https://t.co/tSTPudVhbF https://t.co/PeVirdWj81",0,baseline test
"The perfect companion for home owners, home sellers and home buyers! The latest Western Property has landed.
 

 Digital Edition 
 https://t.co/TrzgcCX9FV",0,baseline test
"OUT NOW: the new digital edition of ARTMAG has the latest Scottish arts news. View and download it: https://t.co/ofvm7vDRdu
 Image Andrew Fitzpatrick, Edinburgh.
 onlinemagazine digitalmagazine magazines magazine artmagazine artmagazines artmaguk artmags https://t.co/4IOA4dlc0w",0,baseline test
"NexiGo PS5 Accessories Holiday Bundle, Controller Charger Special Edition, 1500mAh Battery Pack, Horizontal Stand for Disc &amp; Digital Edition https://t.co/E7SvIUVvyt",0,baseline test
"In the third in series of official updates, we hear from those tasked with delivering the Faith Action Programme of the . To stay informed, subscribe or buy a single issue and choose from a print or digital edition https://t.co/X2NrNCdoD2 https://t.co/NXsX8QlBIH",0,baseline test
NowPlaying blues : Realize (Digital Edition Bonus Track) by Wolves Like Me - Listen Online at: https://t.co/gGtitroi0i https://t.co/MCgZtL1xgK,0,baseline test
"...""It's all out there..."". The brand new issue of is out now with the digital edition free (normally four bucks) to download here: 
 https://t.co/J27y8LxWs9 https://t.co/l3ehhsCLdh",0,baseline test
"Join for Accelerate22 digital edition this May as we deliver inspiring and innovative sessions designed to broaden your perspective, engage your thoughts, and help you improve your security senses.
 

 Register now: https://t.co/xor0v2g9op https://t.co/ePrMVMqJ50",0,baseline test
"Feb 27 BK
 Visit https://t.co/TTcvA5mVA9 for latest and authentic news
 Digital edition Epaper. Brighterkashmir. Com
 Instagram/brighter_kasmir
 Twitter/brighterkashmir
 Facebook/brighterkashmir
 YouTube/brighterkashmir
 Hard copy available on all news stalls in Kashmir https://t.co/HwbXwwJ5Wa",0,baseline test
"Read the March issue of The Director magazine before it lands in your mailbox! Download our Director magazine app today - free in the Apple or Google play store. 
 

 https://t.co/Mt43sTS3g1 https://t.co/i7biAcpy03",0,baseline test
"vinyl for christopher otto &amp; 's rag'sma is now officially sold out... a big thank you for everyone who supported this physical release!
 

 as with all greyfade albums, the LP will not be repressed. 
 

 digital edition still available here:
 https://t.co/gwq0KBInEA https://t.co/cpOGG8AKPV",0,baseline test
"Morjor PS5 Carrying Case with 4 Detachable Compartment Dividers for Storage Customization, PS5 Case Compatible with Playstation 5 Disc/Digital Edition, PS5 Controllers, Games, Headset and Accessories https://t.co/dbbuvoS50u",0,baseline test
"We're excited to share with you our new Faith and Family Collection. In this new digital collection, we’ve combined some of the best Q&amp;As from Core Radio into unique Faith and Family episodes. Download your copy here: https://t.co/8aaINr5Y4p https://t.co/mCFdk6wnRZ",0,baseline test
May is AAPIHeritageMonth! HOLLIS users can access our digital collection of AAPI in academia materials at https://t.co/jbbHp0gqKe https://t.co/KCUwocrS27,0,baseline test
"What a terrific old map. We have struck a gold mine of excellent cartographic material with the Johns Hopkins digital collection. This one shows Baltimore in 1872. Click on it for a much larger, detailed version. https://t.co/ze4gBgpdk3",0,baseline test
"Take a walk down memory lane when you explore the UT Volunteers Baseball Media Guides. This digital collection features guides published between 1982 and 2011. Make it a true tbt and check it out! https://t.co/DcEVDFMcCx
 vols baseball utk https://t.co/Xbl8VaiA7m",0,baseline test
"♫ Check out This Album ""The Digital Collection"" on Anghami  https://t.co/T6BSc4r1SF",0,baseline test
"Gain access to new D&amp;D adventures, monsters, player options and more with a Wizards Account.
 

 An ever expanding digital collection of goodies to unlock can all be found right here: https://t.co/dn3eZ3IOtK https://t.co/6jpnowp7c0",0,baseline test
"Bathroom for 2
 From DUOS digital collection
 Duos GaySex friendswithbenefits 
 https://t.co/KLKgpDG4HK https://t.co/lg7TIWpFN4",0,baseline test
"We've just launched our Pat Boone Digital Collection, featuring objects from Pat Boone's personal archive, including setlists, personal correspondence, and photographs with presidents, family members, and fellow performers on stage and in the studio. https://t.co/vOEDEop9PW https://t.co/rEpiDUi64e",0,baseline test
"I just added to our digital collection what may be one of my favorite recent items I've encountered.
 It's a book commemorating the 75 years (1901-1976) that Stamford Hospitals school of nursing operated.
 

 https://t.co/qYueRPZxqt",0,baseline test
"Making a career change, moving to a new city or just moving on? Before taking the leap, hear from career experts in videos.
 

 Access 16,000+ courses &amp; tutorials on skill development, career management &amp; more with your Library card: https://t.co/vzXxanomir
 

 LdnOnt https://t.co/EBcYlSUEah",0,baseline test
"Celebrate WomensHistoryMonth by using your FREE librarycard to check out these acclaimed titles, plus hundreds more books, eBooks, eAudiobooks, movies &amp; music from our digital collection on  ! https://t.co/LZctBS16QS InspiringWomen GetCarded https://t.co/Cld5CSpOGi",0,baseline test
Home | Fluxus Digital Collection https://t.co/1PPvlCIfvd,0,baseline test
"Dr. Timuel D. Black, Jr was a beloved civil rights leader, educator, Chicago historian, and friend of the Foundation. His commitment to civil rights have shaped this city and country in so many ways. Learn more through the Timuel D. Black Collection: https://t.co/wzFPV6zeEX https://t.co/qEvmTsKTim",0,baseline test
"WeChat cracks down on digital collection transactions, a large number of public accounts are banned https://t.co/T4CZWWAynk",0,baseline test
"This week we are featuring historic photo in Marott Park in the 1950s from the Digital Collection! 
 The Indy Library is looking for volunteers to identify photos from the Indy Parks collection! View more details here: https://t.co/fMoA1BCV0i https://t.co/ZAZYt0LAc2",0,baseline test
"Read the latest news through in our Digital Collection. It offers same day access to newspapers and magazines from around the world with publications in more than 60 languages.
 

 Sign in with your Library card at this link: https://t.co/vfY00apwx5
 

 LdnOnt https://t.co/olie2w210S",0,baseline test
"【Topics】PhoPhoNO Digital Archive
 Drenjongke, Dzongkha, Tamang, Burmese, Mon, TibetoBurman, DigitalArchive
 https://t.co/0stTIoQkm9",0,baseline test
"Relating to our April 8 launch of the Mayor Ivan Allen Digital Archive, my colleague &amp; I were interviewed for a podcast episode of , which aired today on . Listen here: https://t.co/px3bNcB0re",0,baseline test
The HistoryMakers Digital Archive is the nation's largest African American video oral history collection. Access 1000s of stories centering black voices with the BestCardInLA: https://t.co/jcxCJe5nYn https://t.co/PsUEPO5f9u,0,baseline test
Some extraordinary images of 20th c. merchants/businesses in Limerick City can be found on the  digital archive https://t.co/0QiAAjrLgS 1/2 https://t.co/eusjpc7q3p,0,baseline test
The Digital Archive - Coming to SuperRare this Thursday  https://t.co/d2H0F2SVuN,0,baseline test
"From the archive: Brian Swann's ""The Meteor and the Deer"" from Volume 23 Issue 1. Read more from this issue in our digital archive: https://t.co/Wf4TIwvx0k https://t.co/p78orTqywj",0,baseline test
"A&gt; South Asian American Digital Archive maintain a wonderful archive about Eqbal Ahmad. Check it out at the link:
 

 https://t.co/bEpWFeXC0r
 

 [END]",0,baseline test
Watsonville in the Heart to launch digital archive https://t.co/Siv32fCRO0,0,baseline test
"Top image: Oil field scene, Hull, Texas, 1920. Horald V. Watson Collection 1978.080-30. Sam Houston Regional Library and Research Center. TSLAC. View in the Texas Digital Archive: https://t.co/ZS4zeb1Cu3",0,baseline test
"Have you taken a look at our digital Archive? The OBU library has a great archive, and a lot is online now! 
 https://t.co/c4pmjou3Wv
 

 obulibrary obubison obuarchives spotlight",0,baseline test
"The William Davidson Digital Archive of Jewish Detroit History holds many interesting advertisements for brands of Passover foods.
 https://t.co/VBRJsWq3VQ",0,baseline test
"Bridge at Rathcurby South, Mooncoin, County Kilkenny,  Kilkenny Industrial Archaeological Survey 1989, available at the Kilkenny Digital Archive, https://t.co/CRM7FRZwiv YourCouncil https://t.co/7VbhxiN8xl",0,baseline test
See what historical life was like in Vermont towns in the Green Mountain Digital Archive MainStreet collection: https://t.co/XFA9ddKpuJ ArchivesOnMyStreet ArchivesHashtagParty https://t.co/Mwkct8S9d4,0,baseline test
"Have you explored the digital archive yet?
 

 They have a fantastic collection of Cardiff rugby material available online, including images of items from the Bleddyn Williams collection held at Glamorgan Archives https://t.co/22KSxWALqT
 

 SportArchives Archive30",0,baseline test
"Hey Northern Renaissance fans, you'll want to check out this incredible digital archive of the works of Lucas Cranach ArtHistory 
 https://t.co/uSSurgG2gE",0,baseline test
UBC Library acquires access to the Afghan Serials Collection and the Afghan Central Press digital archive. Learn more: https://t.co/VRSZKhuQji https://t.co/xsYgeOlCbv,0,baseline test
"From the archive: Anna Kovatcheva's ""Sudba 1"" from Volume 45 Issue 1. Read more from this issue in our digital archive, as well as listen to the author read the story! https://t.co/JyOdGexgft https://t.co/cRI7LNbHFK",0,baseline test
"MobileFriendly site South Asian American Digital Archive https://t.co/poWLJ4LZuz;
 more: Mobile Elegance https://t.co/oTxK50m9nC",0,baseline test
"ICONOCLASTS: Available now in PDF. The PDF comes with a free digital archive of over 80 handouts. A hardback edition is available for preorders. Reserve it now and get the PDF and handouts immediately. The Father of War waits. 
 https://t.co/GYk21IXjx2 https://t.co/EgomaAIPWa",0,baseline test
"Did you know we hold a large archive of film footage in a variety of formats 
 

 Discover our digital archive here &gt;&gt; https://t.co/YRB4YBjtwd, where you can donate to a range of projects &amp; help us bring more of The Boys’ Brigade’s rich history back to life",0,baseline test
The UWMatWaukesha Field Station Digital Archive is now live! This collection features images from the first 50 years of the Field Station. Check it out here: https://t.co/a2IfocgcGg https://t.co/IUQfEtEtq4,0,baseline test
Digital Archive: Abusive Speech &amp; Online Platform Governance https://t.co/i1GCZSAutC via,0,baseline test
Rare digital archive of Kerala-related articles in doldrums https://t.co/DFOxVVm9fg,0,baseline test
"The Legacy Trust has launched a digital archive with thousands of articles, videos, and audio recordings of Rabbi Lord Jonathan Sacks. 
 

 https://t.co/XehNu6afwZ",0,baseline test
"From the archive: Alex Epstein's ""On the Mourning Customs of Elephants"" from Volume 38 Issue 2. Read more from this issue in our digital archive: https://t.co/YvRUc9iQLl https://t.co/IfNmrnhgZL",0,baseline test
BBC opening digital archive for formal education | - Advanced Television https://t.co/fi3K6Zc32q,0,baseline test
"The University of Northern Iowa keeps a digital archive on AleisterCrowley.
 

 https://t.co/qgTvWK5gtS",0,baseline test
The digital archive is already available from the https://t.co/1f9i2Wcn8B,0,baseline test
The Cranach Digital Archive is an amazing resource: https://t.co/KDMj0S9pte,0,baseline test
"researchers have access to a wealth of Gale Primary Source materials via :
  The Times Digital Archive, 1785-2019
  Eighteenth Century Collections Online
  The Economist Historical Archive, 1843-2020
  and morehttps://t.co/ETBZs2yMXr
  https://t.co/72HhcXnH1R",0,baseline test
"Listening to ""AfricArxiv: a community-led OpenScience digital archive for African research communication"" at https://t.co/nME2sk8kVw",0,baseline test
https://t.co/83twtUcvCU is an experimental research project that combines machine learning tools with design of data observatories: web-based interfaces that facilitate searching and navigating across the digital archive of radio signals radio research rca,0,baseline test
"John Brittain's crew and a Stirling. After training as a gunner, he was posted to 195 Squadron at RAF Wratting Common in Feb 1945 and flew 13 operations as a Lancaster mid upper gunner. His log book and collection is in the Digital Archive. https://t.co/6oNXkZ3T3k https://t.co/2FBB5e7lvT",0,baseline test
"""Black Built Pitt"" is a digital archive that explores &amp; highlights Black historical events at sites around the campus. Even though BlackHistoryMonth is almost over, we encourage you to visit these sites throughout the year. Learn more: https://t.co/r9OuuACY0U https://t.co/MXj34WOwl9",0,baseline test
Late night chatting with and and a desire to read this prompted me to subscribe to again after many years away. And now I’ve disappeared down the digital archive rabbit hole and can’t get out. https://t.co/5Mb6owznLW,0,baseline test
"Railway bridge at Ardclone, Piltown, County Kilkenny,  Kilkenny Industrial Archaeological Survey 1989, available at the Kilkenny Digital Archive, https://t.co/CRM7FRZwiv YourCouncil https://t.co/mvHMAtXyd5",0,baseline test
"PhD Studentships: Digital Archive of the Middle East (DAME), Institute of Arab and Islamic Studies
 Job title: PhD Studentships: Digital Archive of th...
 jobs jobsnearme 
 https://t.co/3mDvSf3BEy",0,baseline test
Subscribe to H&amp;E and you get: The magazine delivered to your door every month in a discreet envelope | Save ££s on the shop price | Free access to digital archive back to 2007 and extra galleries/supplements | From just £4.50 a month via direct debit https://t.co/ldCWjCFPT5,0,baseline test
Try reaching out to Paul Barnaby over at the Walter Scott Digital Archive for what's most popular maybe? https://t.co/yg4HwS7I93,0,baseline test
"...and Grammar School. I already had his newspaper photo so I've added that to the Keighlian School virtual memorial and another blank space is now filled! One day we might have them all:
 https://t.co/cQbRZFZWYC",0,baseline test
Black Life in America—a unique digital archive of news media—presents the broad sweep of African American history by offering balanced coverage from diverse sources published from 1704 to now. Give it a try! https://t.co/TUNhIQJDGh BlackHistoryMonth2022 blackculture https://t.co/xnQQ6WOJNC,0,baseline test
"Hot off the press, a brand new Boots for Dancing digital archive put together by Michael Barclay in groovy dayglo apparel, &amp; chock-full of words &amp; images collected &amp; selected from the back pages of Edinburgh's punk-funk class of '79. https://t.co/78BePBEGgj  https://t.co/mQi6bQWjuF",0,baseline test
My growing digital archive of Tigrikorn Fanzine editions that showcase years of Cartooning Class Student work is hosted at : https://t.co/1ni5zI6r4n https://t.co/r5jy0QuwFw,0,baseline test
"a true pleasure to speak at DAS2022 today on how https://t.co/lznpLOtC9b is a digital archive for the past, present and future of black film. i’m sincerely proud to be a new member and thankful i was able to present. thank you!",0,baseline test
"Lee, while researching the post WW II Sino-American book, study GC Marshall '46 China. Regarding the '30 Tyrants', GCM was a student of Thucydides, who was charged by the regime of the Thirty Tyrants and then disappeared. , https://t.co/G70IaobQHM",0,baseline test
"Companionable and unstuffy, is more like a well-read friend than a literary magazine. 
 

 Libraries can subscribe to the complete &amp; fully-searchable digital archive for unlimited IP-authenticated access 
 

  https://t.co/g8Hr8YyZ3G https://t.co/e4q1XzLJf5",0,baseline test
